{
  "$schema": "./schema.json",
  "jurisdictionKey": "idaho-unincorporated",
  "jurisdictionDisplayName": "Idaho — unincorporated default (statewide minimums)",
  "note": "Fallback table for Idaho parcels that fall outside a county-level zoning ordinance we have explicit district rows for. Values mirror Idaho Code Title 67 Chapter 65 (Local Land Use Planning Act) defaults and the Idaho International Residential Code amendments for fire-separation. Used by the briefing engine when an INSIDE Idaho parcel lookup succeeds but the resolved jurisdiction has no local-tier setback table.",
  "districts": [
    {
      "district_name": "Default Unincorporated Residential",
      "front_ft": 25,
      "rear_ft": 20,
      "side_ft": 10,
      "side_corner_ft": 20,
      "max_height_ft": 35,
      "max_lot_coverage_pct": 30,
      "max_impervious_pct": 40,
      "citation_url": "https://legislature.idaho.gov/statutesrules/idstat/Title67/T67CH65/"
    },
    {
      "district_name": "Default Agricultural",
      "front_ft": 50,
      "rear_ft": 50,
      "side_ft": 25,
      "side_corner_ft": 50,
      "max_height_ft": 35,
      "max_lot_coverage_pct": 10,
      "max_impervious_pct": 15,
      "citation_url": "https://legislature.idaho.gov/statutesrules/idstat/Title67/T67CH65/"
    }
  ]
}
